,pagetext,title,timestamp,url
22,"The Dossier Center, an investigative journalism project by Mikhail Khodorkovsky, has reportedly discovered a guide prepared by the Putin administration for local agitators and media sources to use when discussing the Russian president’s proposed constitutional changes. MBK Media, which is also associated with Khodorkovsky, published excerpts from the talking points. Other sources have not yet verified the authenticity of the document. If the guidelines are authentic, it appears that the Kremlin has divided the Russian populace into six groups for the purpose of promoting Putin’s reforms. The document offers talking points and suggestions for approaching each group, including examples of rhetoric that can be used for canvassing or adapted for media headlines. Group 1: Elderly voters The purported guidelines encourage constitutional reform agitators to win over pensioners and other older Russian citizens by bringing up topics like patriotism, the family, and the futures of their children and grandchildren. The talking points also encourage comparisons between the present day and the economically chaotic 1990s, which allow advocates to “play on fears of instability.” The slogans devised for this group include: Group 2: Patriots The Kremlin reportedly suggests approaching this group using, well, “patriotic motifs” such as defending national sovereignty and establishing the supremacy of the Russian Constitution over international law. Associated slogans include: Group 3: Loyalists The reported administration talking points for this group understandably focus on the president himself, using his accomplishments as president to ask for trust in his choices. Slogans include:  Group 4: Young voters
 According to the Dossier Center, strategies for promoting Putin’s constitutional changes to youth make up the largest section of the Kremlin’s guidelines. The gist of those suggestions is that young people should be told the current vote is a historic one — the reforms represent a new era of change when Russians must “move forward and change the country for the better.” Some of the slogans involved employ contemporary slang: Group 5: Low-income voters In this case, the Kremlin has reportedly chosen to lean into the argument that the proposed constitutional changes will provide social welfare guarantees and improve everyday life in Russia, including for the country’s most disadvantaged classes. Slogans include: Group 6: Putin’s critics The administration guidelines recommend confronting voters critical of the Putin government by arguing that the new constitutional amendments would guarantee regular regime change, protect the government from the errors that accompany individual autocratic rule, and reinforce the separation of powers, enabling various branches of government to support one another. Some of the slogans for this group are actually directed against Vladimir Putin: The slogans included in the guidelines reported by the Dossier Center align with an earlier leak of government agitation strategies reported by Kommersant. Those strategies allegedly focused on three themes devised by specially hired political strategists: respect for popular opinion, participation in a historically significant event, social justice, government turnover, and the protection of territorial sovereignty. As Meduza previously revealed, the Putin administration is aiming for a turnout rate of more than 50 percent in the nationwide constitutional vote that is set to take place April 22. To achieve that turnout, the Kremlin is leaning hardest on the social welfare component of the proposed reforms, such as measures indexing pensions to inflation and tying minimum wages to living wages over time. The decision to concentrate on those proposals was based on polling that showed many Russians are nostalgic for the social guarantees of the Soviet era.",‘Want Putin gone? Vote for the Constitution!’ How Kremlin talking points on Putin’s constitutional changes are reportedly targeting Russians across the political spectrum,"9:41 pm, February 28, 2020",https://meduza.io/en/feature/2020/02/29/want-putin-gone-vote-for-the-constitution
23,"A new survey conducted by the independent Levada Center and published by Open Media indicates that one quarter (25 percent) of Russians are willing to vote for the major constitutional changes proposed by President Vladimir Putin in January. Another 37 percent of respondents said they would participate in the nationwide vote on the measures but were not yet sure whether they would vote in favor. 23 percent of respondents said they would not take part in the vote, and 10 percent said they would vote against the measures. A majority (65 percent) said they do not understand the essence of the proposed reforms, and 58 percent said they did not understand what the changes are for. Half of those who said they were willing to vote for the proposals said they did not clearly understand what the reforms would change in the Constitution. Among those who said they support Vladimir Putin, 36 percent said they would vote for the changes. Among Putin’s opponents, 38 percent were unsure how they would vote. A nationwide vote on the proposals is set to take place on April 22. It will not be an official referendum and therefore may not be legally binding.",Levada Center: 25 percent of Russians favor constitutional changes; 65 percent don’t understand them,"5:18 pm, February 28, 2020",https://meduza.io/en/news/2020/02/28/levada-center-25-percent-of-russians-favor-constitutional-changes-65-percent-don-t-understand-them
24,"The Russian naval frigates Admiral Makarov and Admiral Grigorovich departed from Sevastopol for the Mediterranean Sea on the morning of February 28. Both were carrying Kalibr-NK missile complexes. At around midday, the two ships passed through the Bosporus in Turkey, the Daily Sabah reported. The previous night, an airstrike in the Idlib region of Syria had killed 33 Turkish troops. Russia and Turkey are opposed in a proxy war in Syria that is growing increasingly close to a hot war between the two major world powers. Both Turkish and Russian representatives said the February 27 – 28 airstrike was carried out by Syrian government forces, not Russian troops, but Russian military spokespeople argued that Turkish soldiers had been interspersed in terrorist units “where they’re not supposed to be” during the strike. Russia’s Black Sea Fleet indicated that the Admiral Makarov and Admiral Grigorovich are set to join the Russian Navy’s established fleet in the Mediterranean Sea, where another frigate, the Admiral Essen, also has Kalibr missiles on board. However, Russia’s Defense Ministry did not specify whether the move was routine or the result of current events.",Russia sends two armed frigates through Bosporus following deadly Syrian airstrike against Turkey and rising tensions,"4:51 pm, February 28, 2020",https://meduza.io/en/news/2020/02/28/russia-sends-two-armed-frigates-through-bosporus-following-deadly-syrian-airstrike-against-turkey-and-rising-tensions
25,"In late 2019, many Internet users started noticing that the Russian state media was increasingly describing gas explosions as “gas pops” in news coverage — even when the incidents caused major damage to life and property. In fact, the number of “gas pops” mentioned in news reports jumped from a few dozen stories in early 2017 to thousands of such reports by January 2020. Meduza’s sources in the presidential administration and Russia’s security agencies say this is the result of a targeted policy to introduce more “favorable information conditions” meant to avoid a public panic when reporting gas explosions.  In the latter half of 2019, readers of Russia’s state media started drawing attention on social media to news reports about explosions, like natural-gas explosions, where the word “explosion” was bizarrely being replaced by the word “pop” (khlopok). This has repeatedly led to absurd headlines about a “gas pop” above a photograph showing a smoking ruins and a story about dozens of people being injured or even killed. For example, in December 2018, Izvestia cited regional officials from Russia’s Emergency Management Agency when describing a “gas pop” at a residential building in Magnitogorsk that killed 39 people. On social media, several readers have started asking if the strange editorial policy is the result of censorship.  When covering gas explosions in other countries, however, state-controlled and pro-Kremlin media outlets in Russia have avoided the same doublespeak. When a gas explosion injured seven people in Kazakhstan this January, for example, the Russian Defense Ministry’s television network, Zvezda, called it an explosion. Once again, Twitter users were quick to highlight the media’s apparent double standard. At Meduza’s request, the media-monitoring firm “Medialogia” studied the use of the word “pop” in Russian news headlines and found that it started supplanting the word “explosion” last fall. In stories about the same events in recent months, the frequency of “gas pop” in news headlines has grown as the use of “gas explosion” has declined. In January 2020, the Russian media mentioned “gas pops” a record 1,300 times, which was four times more than in September 2017. (For comparison, Medialogia, which indexes 53,000 different sources, tracked just 58 instances of “gas pop” in news headlines.) In other words, the Russian media has systematically and simultaneously switched from “explosions” to “pops” when reporting these disasters. What’s the difference between a pop and an explosion? A “gas pop” is, in fact, a real technical term that has appeared for years in official documents, specialized literature, and service instructions. For example, the “RAO UES” electric holding company’s “Instructions for the Investigation and Accounting of Fires at Energy Facilities,” released in 2002, offers the following definitions of the terms “pop” and “explosion”: 
A burst (or pop): The rapid combustion of a combustible mixture not accompanied by the formation of compressed gases capable of destroying structures or installations. An explosion: A rapid exothermic chemical transformation of an explosive environment accompanied by the release of energy and the formation of compressed gases capable of destroying structures or installations.  Basically, a “gas pop” is an explosion that causes no major destruction. Maybe emergency workers simply misuse the specialized terminology, which then slips into the mass media through their official statements and confuses everyone, especially in cases when the damage caused by a gas explosion is visible with the naked eye. For example, statements published on the Federal Emergency Management Agency’s website over the past decade show that the agency regularly uses the word “pop” in press releases with phrases like “gas-air-mixture pop,” regardless of the damage caused by these blasts. Even the first official reports about the 2009 Sayano-Shushenskaya power station accident, which killed 75 people, used this same term in statements like: “Power station personnel inside the engine room heard a loud pop in the area of the hydraulic unit.” The agency’s press office provided Meduza with an excerpt from recommendations issued by its Civil Defense and Emergencies Research Institute, which guide the press office’s operations. The document says a “gas pop” and “gas explosion” differ in consequences and the latter can cause major damage. According to the beginning of the recommendations, however, the term “gas pop” should “be equivalent” to the technical term “gas explosion,” leaving the final choice over wording with the agency’s spokespeople.  Additionally, the agency’s local branches are also transmitting information “according to a principle of ‘incite as little panic as possible,’” a source in the Federal Emergency Management Agency told Meduza.  Perhaps the same logic guides Russia’s Investigative Committee when it issues a press release about a criminal probe into a deadly “gas pop” — the same explosion at a residential building outside Rostov pictured at the top of this story.  So is this incompetence or a deliberate policy? Sources told Meduza that the rising use of “gas pop” in news coverage is neither an accident nor the result of bureaucratic jargon slipping unnoticed from official press releases into media reports. Like other examples of government newspeak — such as “saturation” (podtoplenie) instead of flooding and “combustion” (vozgoranie) instead of fire — the term “gas pop” is part of the Russian presidential administration’s information policy.  A source close to the Kremlin’s domestic policy team under Vyacheslav Volodin (who worked as first deputy chief of staff from 2011 to 2016 and now serves as the speaker of the State Duma) described the administration's policy in the following terms: “A gas pop is a classic example of favorable information conditions, where the emphasis is placed on good news and bad news is veiled. We hear nine stories about good news plus something about some gas pop. There are no disasters.” Another source in Russia’s security apparatus confirmed to Meduza that the government pursues a policy of “reducing negativity” in the news. “I can say that there is definitely a push to understate damages,” says Meduza’s source. “If the emergency services report ‘combustion,’ it means everything’s already in flames. If they say there’s smoke, then it’s definitely on fire and maybe even a couple of people have burned up.” Several sources told Meduza that Alexey Gromov, the Putin administration’s first deputy chief of staff, holds weekly meetings with the heads of press services at key government agencies whose reports are a main source of information for the national news agencies that in turn feed the entire Russian news media. In these briefings, Gromov outlines the main topics ahead in the week and issues instructions about the “correct” presentation of the government’s agenda. “When it comes to statements about important news events that arise unexpectedly, press-service directors coordinate directly with [Alexander] Smirnov [who oversees the Kremlin’s public relations and communications department] or even Gromov,” says Meduza’s source. Another police source confirmed that the presidential administration tries to control the publication of information about emergencies, telling Meduza that not only press-service executives at government agencies but also the very heads of state news agencies sometimes coordinate the public release of information. “It’s not about saying black is white or white is black. It’s just that, in order to respond to an incident, you need to understand its scope and collect data, so it’s reasonable at first to avoid words like ‘explosion’ and write ‘pop,’ instead,” explains Meduza’s source. Speaking to Meduza, a current presidential staff member (who asked not to be named) categorically denied that the administration has instructed any press services or news agencies to write “gas pop” when describing gas explosions. “Yes, we’re also surprised when we see these stories about pops. It honestly doesn’t look great. The presidential administration has never — not now or before — conveyed any wishes in this regard,” said Meduza’s source, who also suggested that the media is taking the word “pop” from initial statements issued by the Federal Emergency Management Agency when emergency workers themselves still “scarcely understand what’s happened, which is why they use this term.” A former correspondent for one of Russia’s leading news agencies, however, confirmed to Meduza the effort to ensure “favorable information conditions”: “It’s done to prevent a panic. The word ‘explosion’ is scary and negative, whereas ‘pop’ is somehow easier. In the vast majority of cases, news agencies will write about gas pops until some federal agency like FEMA, the National Anti-Terrorism Committee, or the Federal Security Service declares it an explosion. And this isn’t even because they might get an angry phone call from someone high up, but simply because it’s better to play it safe. I never saw any specific instructions on this subject and I was never issued any direct guidelines — it’s just how it’s done. It’s customary.”","Don’t panic Why the Russian news media has started reporting major gas explosions as adorable, harmless ‘pops’","2:25 pm, February 28, 2020",https://meduza.io/en/feature/2020/02/28/don-t-panic
26,"The Democratic Party's primaries are underway in the United States, where the country's increasingly left-leaning political party is flirting with democratic socialist Vermont Senator Bernie Sanders as its nominee. Additionally, recent reports citing U.S. national intelligence that Russian operatives are again trying to interfere in the American presidential election have revived the media's interest in “RussiaGate” discourse that finally faded only last year with the release of the Mueller Report. With all this talk of “the Russians,” however, what do Russian people in the U.S. actually think about the presidential race? On this episode of “The Naked Pravda,” host Kevin Rothrock spoke to seven liberal- and left-leaning Russians who currently reside in the United States about their views concerning the Democratic primaries and what they think of “RussiaGate” news coverage in the American media. “The Naked Pravda” comes out on Fridays. Catch every new episode by subscribing at Apple Podcasts, Spotify, Google Podcasts, or other platforms. If you have a question or comment about the show, please write to Kevin Rothrock at kevin@meduza.io with the subject line: “The Naked Pravda.”",‘Russians in America’: Russian immigrants and visitors in the U.S. discuss  the 2020 Democratic primaries,"1:25 pm, February 28, 2020",https://meduza.io/en/episodes/2020/02/28/russians-in-america-russian-immigrants-and-visitors-in-the-u-s-discuss-the-2020-democratic-primaries
27,"Russian entrepreneur Alexander Udodov, who is the husband of current Prime Minster Mikhail Mishustin’s sister, has already been accused of illegally recovering value-added tax payments from the Russian government’s budget. Now, it has also become clear that he used to own six apartments in central New York City. The apartments are in the same building where entrepreneur Denis Katsyv purchased real estate. The U.S. government accused Katsyv, who owns Prevezon Holdings and is the son of a former Russian Railways vice president,of taking part in the tax fraud case uncovered by Sergei Magnitsky, whose 2009 death in a Moscow jail led to the passage of the Magnitsky Act. The connection between Katsyv and the prime minister’s family forms the center of a new report from opposition politician Alexey Navalny’s Anti-Corruption Foundation (FBK).  Who is Alexander Udodov? Before Mikhail Mishustin became Russia’s prime minister, Alexander Udodov rarely appeared in the news. In 2011, when Mishustin took the helm at the Federal Tax Service (FNS), Kommersant and RBC mentioned Udodov as an acquaintance of Mishustin’s and a suspect in an attempt to embezzle two billion rubles through fake VAT returns. At the time, Kommersant described the businessman as “officially unemployed but a major decision-maker in the tax world.” Both outlets as well as Open Media reported that investigators believed Udodov to be involved in the crime itself, but he was nonetheless designated as a witness, not a defendant, in the case. When Mishustin exchanged the top spot at the FNS for the prime minister’s seat, journalists once again turned their attention to Udodov. Some wrote about his business dealings: He owns a company called Gribnaya Raduga (Mushroom Rainbow) that produces edible champignons as well as a mineral water bath resort called “Thermals” in the Krasnodar region. Other journalists looked into the entrepreneur’s ties with Mishustin: Udodov is still a fixture in the prime minister’s circles; he gave Mishustin’s sister Natalia Stenina luxury real estate for free; he and Stenina co-own the Sportim hockey club (where Mishustin plays); they also co-own a restaurant called The Not-So-Far East. Amid that burst of interest in Udodov, the tabloid newspaper Moskovsky Komsomolets ran a story titled “Alexander Udodov: A biography of an investor who’s developing our country’s economy.” Three weeks later, Udodov gave an interview about his work to the national newspaper Izvestia. In that piece, he also denied any involvement in the illegal VAT returns and clarified the nature of his connection with Mishustin: “The truth is that since 2008, I’ve been married to his sister, Natalia. […] We don’t live together anymore, but I still have a good relationship with her family, and our moms are friends,” Udodov said. What did the FBK find out about him? Udodov previously owned six apartments at 20 Pine Street in New York City. The building is a short walk away from Wall Street. City real estate records cited by the FBK indicate that in December 2009, Udodov acquired five apartments in the building, buying a sixth in June 2010. The purchases cost the businessman $6.4 million. In every case, the properties were first registered to commercial firms with a series of similar names (PINE 2315, PINE 2401, PINE 2407), and Udodov subsequently purchased those companies. The FBK’s report indicates that Udodov rented out at least some of the apartments. By 2018, he had sold all of them. The FBK noted that Udodov bought real estate in the Pine Street building just three weeks after a Cyprus-based firm called Prevezon Holdings, owned by Denis Katsyv, had done the same. In 2013, Prevezon was targeted in a U.S. federal investigation. According to American officials, Prevezon Holdings used real estate purchases in New York City to embezzle money received from Russia via a tax fraud scheme discovered by Sergei Magnitsky. The federal investigation led government officials to freeze four of the five apartments Prevezon Holdings had purchased in the Pine Street building over the years. In 2017, however, the company settled with the government out of court, and the charges against it were dropped in exchange for $5.9 million. That is approximately three percent of the sum the U.S. government initially demanded from Prevezon Holdings, and Katsyv celebrated the end result of the case as a victory for him. “It’s practically an apology on the government’s part,” Faith Gay, an attorney for the company, told RBC. She predicted that all of the company’s frozen assets would be released. In its report on Udodov, the FBK expressed suspicion at the fact that he and Prevezon Holdings had purchased real estate in the same building in New York at about the same time. “Here’s how the situation looks at this point: Government funds were embezzled on an unprecedented scale through the Federal Tax Service of the Russian Federation (‘Magnitsky’s case’). The embezzlement has been thoroughly, fully demonstrated, and a dozen countries have opened criminal cases (though Russia hasn’t, of course). Some of the stolen money was given to Denis Katsyv, who immediately used it to buy apartments in New York. Three weeks later, the brother-in-law of the head of the Russian Federation’s tax service buys five apartments in the same building in New York. In fact, the apartments are legally co-owned by his wife, Mishustin’s sister. And then, there are the aggravating circumstances: This brother-in-law (Udodov) has been cited in the news media many times […] as somebody who has organized embezzlement schemes using VAT returns,” the FBK report declared.","In the same New York building where Magnitsky uncovered tax fraud, PM Mikhail Mishustin’s brother-in-law owned multiple apartments, investigation finds","7:41 pm, February 27, 2020",https://meduza.io/en/feature/2020/02/27/in-the-same-new-york-building-where-magnitsky-uncovered-tax-fraud-pm-mikhail-mishustin-s-brother-in-law-owned-multiple-apartments-investigation-finds
28,"Russia’s Federal Tax Service (FNS) has blocked all transactions for Citibank accounts belonging to Gugl, Ltd., the Russian branch of web services giant Google. The move was first reported by the Moskva news agency. The FNS indicated that it blocked Google’s accounts in order to extract outstanding fines and taxes. Representatives for the company’s Russian branch called the account blockage a “technical issue,” according to Interfax. Kommersant wrote that the Federal Service of Courtroom Bailiffs has two orders for state duties out against Gugl, Ltd. Their total value is 4,100 rubles ($61.95).",Federal Tax Service blocks accounts for Google’s Russian branch,"3:14 pm, February 27, 2020",https://meduza.io/en/news/2020/02/27/federal-tax-service-blocks-accounts-for-google-s-russian-branch
