,pagetext,title,timestamp,url
12,"On March 2, Russian State Duma speaker Vyacheslav Volodin announced a series of additions to President Vladimir Putin’s proposed amendments to the country’s constitution. The amendments, introduced into the State Duma by Putin himself, include a measure banning same-sex marriage and a passage outlining the government’s view of Russian history and unity. On March 3, a group of journalists attempted to clarify the meaning of the newly proposed measures in the following conversation with Putin’s press secretary, Dmitry Peskov.  Kommersant FM: Vladimir Putin’s amendments to his own amendments to the Constitution came out [yesterday]. There’s a phrase in that document about the memory of our ancestors who gave us our ideals and our faith in God. Whose ancestors did Vladimir Putin have in mind? Kremlin Press Secretary Dmitry Peskov: Which section being amended are you referring to? Kommersant FM: The one Vyacheslav Volodin read. As far as I understood, it was a preamble. Dmitry Peskov: I’ll tell you what. The thing is that not all of this information is true to reality. Not all of this information corresponds to what the president introduced. That is, what was published on a large scale yesterday wasn’t true to reality. Let’s continue. I’ll find it in the meantime. [Searches for quote] Kommersant FM: Then could you publish it on the Kremlin’s website or send it out to media outlets so that we can at least understand what Volodin is talking about and what Putin introduced? Dmitry Peskov: You know texts that are introduced like this don’t get published [like other bills usually do]. It’s what’s called an official introduction. However, needless to say, it will be published sooner or later. I just can’t tell you when. Right now, the working group [for Putin’s constitutional amendments] is also continuing to work, and so are the Duma and the relevant committees. Experts, lawyers — everyone’s still working. Kommersant FM: Of course — it’s just that we all heard the announcement from the Duma yesterday that Putin proposed this and that, and now we’re being told that he didn’t actually propose this or that. Dmitry Peskov: No, nobody said “neither this nor that,” and nobody said “this and that,” either. It’s just very important here to go off the specific language [of the proposals]. Some information that appeared in the media yesterday in that respect was not true. Now it’ll just take a while to figure out exactly what information wasn’t true and which facts it misrepresented. Kommersant FM: Maybe you’ve found it by now — the sentence starts with “The Russian Federation, united by a thousand-year history and in testament to the memory of its ancestors, who gave us our ideals and our faith in God as well as the continuous development of the Russian state, recognizes this historically formed governmental unit.” Does that phrase appear in Vladimir Putin’s amendments? Dmitry Peskov: I’m still looking because it’s quite a long text. Kommersant FM: The attorneys we and other news sources have contacted have expressed doubts in the legitimacy of adopting these changes into [the Constitution] because the adoption process contradicts current Russian law. For example, [under the new amendments], the Constitutional Court would evaluate the constitutionality of acts that have not yet been passed, but it has no such right. Dmitry Peskov: That’s a question for the lawyers. However, as you understand, attorneys in the Duma and the presidential administration are actively involved in expert legal analyses of these amendments. So a legal analysis has already been completely conducted here. Kommersant FM: And on what basis did the Kremlin make the decision to circumvent established procedures and pass the amendments through a special process [i.e. through a non-binding nationwide vote as opposed to the binding referendum process described in Russian law]? Dmitry Peskov: I don’t understand the point of the question. This process isn’t prohibited by law in any way. Kommersant FM: What I mean is that there’s a particular process for passing [constitutional] amendments in the law, and what we’ve got is a different process. Dmitry Peskov: But other processes aren’t prohibited. All of these clarifications should be directed toward the working group. Kommersant FM: So the Kremlin doesn’t see any problems in the legitimacy of amendments to the law of the land if there’s a process that’s not provided for… Dmitry Peskov: An expert legal analysis is constantly ongoing. [Finds quote] Look, yes, indeed, “who gave us our ideals and our faith in God.” Yes, that phrasing is in there. Kommersant FM: So whose ancestors did Vladimir Putin have in mind? Dmitry Peskov: Our ancestors, yours and mine. The ancestors of those who live in the Russian Federation. Kommersant FM: And what ideals did those individuals give us? Dmitry Peskov: Our common ideals. Well, that’s implied in the text. Kommersant FM: And which god did Vladimir Putin have in mind, exactly? Dmitry Peskov: I think that will be clarified in due time. Kommersant FM: How? In a separate federal law? Dmitry Peskov: No. I can’t answer that question right now. Kommersant FM: Will our government consequently stop being secular in nature? And how will the government treat atheists if these amendments are passed? Dmitry Peskov: I can’t answer that question right now either. [Pause.] Obviously, the government is not losing its secular nature in any way. Kommersant FM: In what way and at what time will this question regarding ambiguity in [the language about] God and ancestors be resolved? Dmitry Peskov: I can only say that [it will be resolved] in due time. I cannot currently offer you the precise format and the precise timing of these explanations. Kommersant FM: Will it at least be before the amendments are passed? Dmitry Peskov: Well, that should go without saying. Before they’re passed, before they’re voted on, there will be a wide-ranging campaign to elucidate these amendments. Both the president himself and the members of the working group have said this on numerous occasions. Kommersant FM: The amendments also include language about the continuous development of the Russian state and the historical formation of this governmental unit. What is to be done with the more controversial points in our history? For example, does this recognize the unity of the Romanov dynasty and the Bolsheviks who ultimately shot them to death? Dmitry Peskov: Let’s not get into a deep historical discussion here because that’s not my role. I recommend that you contact the members of the working group. Kommersant FM: But it was the president who introduced the amendments. Dmitry Peskov: Yes, of course. But because we’re talking about changes to the Constitution, a juridical evaluation would be appropriate, and I am not qualified to offer such an evaluation. Kommersant FM: I understand. But here, there’s also an aspect of the government undertaking to defend the historical truth. But again, about those controversial points. How should the results of the Civil War be evaluated here? Whose side is the historical truth on — the whites or the reds? Dmitry Peskov: I’ve already said everything I had to say on this topic. I will not be adding anything more at this point. Without a doubt, you have the right to ask these questions. I am simply giving you a hint as to where you can redirect them. Kommersant FM: But it’s not the working group that’s introducing [the most recent amendments]. It’s Vladimir Putin who introduced them. Dmitry Peskov: Yes, but a juridical interpretation is still necessary here. Ekho Moskvy: If you’d permit a clarification question — will this be edited by the president himself, or is this the final text? There are a lot of potential problems [in this version]. Dmitry Peskov: How can something the president has already introduced be edited? The only thing is that right now, the State Duma is conducting an evaluation. Wait a while. With time, there will be explanations and clarifications here. The [Duma’s] deliberations are ongoing. The second reading hasn’t happened yet. But right now, the most important work is being done in the State Duma. Kommersant FM: One more thing — a clarification question about the voting process. Will it be all or nothing, or will [voters] be able to choose individual amendments? Dmitry Peskov: We’ve already provided clarification on that count. Kommersant FM: But you can’t explain it to us yourself. Dmitry Peskov: Because deliberations in the working group are ongoing, I don’t want to provide any conclusions, any clarifications. It would be premature. You and I can go on discussing this for a long time yet. You can see an abundance of topics and interest in those topics. But it’s not a topic for a conference call. Ekho Moskvy: Another clarification, if you please — does this [the new set of amendments] match the president’s vision of what the amendments should be? Dmitry Peskov: And what do you think, that he would introduce something that doesn’t match his vision? Ekho Moskvy: Are you unable to explain these things on his behalf because you don’t completely understand his vision, or what? Dmitry Peskov: I cannot offer an explanation on this matter at this time.","‘Which god did Putin have in mind, exactly?’ In unusually extensive back-and-forth with journalists, Kremlin spokesman engages on questions of God, history, and presidential responsibility for constitutional change","10:26 pm, March 3, 2020",https://meduza.io/en/feature/2020/03/04/which-god-did-putin-have-in-mind-exactly
13,"Anyone who displays respiratory symptoms while arriving in Moscow from countries suffering a COVID-19 outbreak will be removed to a single hospital on the city’s southern outskirts, said Deputy Mayor Anastasia Rakova. The hospital complex in question is located in the town of Kommunarka. Rakova said the facility is already prepared to receive coronavirus patients and provide them with separate accommodations. Patients from Moscow’s Infectious Disease Clinical Hospital No. 1 are already being transferred to Kommunarka. Kristina Tkach, a billiards player hospitalized in the new hospital following a trip to Italy, had previously complained that patients being observed for coronavirus symptoms were not isolated from other patients. Construction for the Kommunarka hospital began in 2017. By December 2019, four buildings had been completed. Five more are scheduled to be built. ",Moscow hospital set aside for coronavirus patients,"4:23 pm, March 3, 2020",https://meduza.io/en/news/2020/03/03/moscow-hospital-set-aside-for-coronavirus-patients
14,"Roskomnadzor, Russia’s media regulation and censorship agency, has reported violations in the operations of the BBC World News television channel, TASS reported. Among the violations is a failure to include age restriction markers in the channel’s programming. Roskomnadzor has submitted protocols on the matter to Russia’s court system, with a hearing set to take place on March 12, 2020. Roskomnadzor conducted checks on BBC World News and the BBC website after the British media regulator Ofcom accused the channel RT of violating British rules and issued a fine of 200,000 pounds ($256,448). The Russian agency openly acknowledged that its investigations were a response to Ofcom’s. Ofcom also fined the company Baltic Media Alliance 20,000 pounds after finding violations in the operations of NTV World Baltia.",Russian media regulator accuses ‘BBC World News’ of violations,"3:35 pm, March 3, 2020",https://meduza.io/en/news/2020/03/03/russian-media-regulator-accuses-bbc-world-news-of-violations
15,"Russia’s Central Election Commission has preliminarily settled on a slogan and logo for the nationwide vote on April 22, when Russians will be asked to endorse sweeping reforms to the country’s Constitution: “Our country, our Constitution, our decision!” The logo shows the Constitution’s cover page printed on the back of the Russian tricolor. The design firm responsible for this feat is the PR agency “IMA-Consulting,” which also provided visuals for Russia’s presidential election two years ago. The logo “represents the imminent positive changes awaiting Russia’s citizens through amendments to the Constitution,” IMA-Consulting said when presenting its work. In mid-January in a major speech, Vladimir Putin proposed drastic changes to Russia’s Constitution that could allow him to remain in power for years to come. A special working group then drafted a series of reforms and, wasting no time, the State Duma approved a first reading of the amendments on January 23. Lawmakers are expected to vote on a second draft as soon as March 10. In addition to significantly restructuring executive powers, the amendments will also define marriage as a union between a man and a woman (banning gay marriage) and mention God somehow.",Russia's nationwide vote on Constitutional reforms now has a slogan and logo,"12:28 pm, March 3, 2020",https://meduza.io/en/news/2020/03/03/russia-s-nationwide-vote-on-constitutional-reforms-now-has-a-slogan-and-logo
16,"An active civil society is more than the so-called non-systemic opposition, which regularly breaks our laws; it’s also the millions of volunteers working across the country. Sometimes I look around at these people with tears in my eyes because they’re working so hard. But God bless the non-systemic opposition, too. I believe they’re deeply needed and that they have a real effect on life, especially at the municipal level in major cities. But there’s the law and everyone must observe it. Or do we want people going around, setting fire to cars in the street? If you want to express your point of view, then get a permit for a public demonstration and go to town. In some countries, unpermitted rallies can cost you five or even 10 years. Get a permit. And if you don’t and you protest anyway, then you’re in for a buzzcut when they lock you up. Take a load off and relax a bit behind bars. And we aren’t the ones who invented foreign-agent status — that was the Americans. Comparing it to the yellow badges the Nazis forced on the Jews is unfair. The only goal of the law against foreign agents is to protect Russia from outside political interference. You can follow the whole “20 Questions with Vladimir Putin” at the state news agency TASS at its website here.",‘Relax a bit behind bars’ Here’s a summary of what Vladimir Putin said about Russia’s crackdown on protesters and foreign agents,"12:00 pm, March 3, 2020",https://meduza.io/en/feature/2020/03/03/relax-a-bit-behind-bars
17,"A Russian military police unit has entered the Syrian city of Saraqib, Idlib Province, Interfax reported. For several days, the city has been the site of active battles between the Syrian army serving Bashar al-Assad and groups of fighters supported by the Turkish government. The city has been transferred from one side to the other multiple times. Russian officials charged with regulating the Syrian conflict told reporters that military police were deployed to Saraqib to provide “uninhibited transport routes for automobiles and for the civilian population” along the major highways that run through the city. On the morning of March 2, Turkish President Recep Tayyip Erdogan said Ankara “has no problems” with Russia in Syria and that his army is not targeting Russian troops in its attacks.","Russian military police enter Saraqib, Syrian city actively contested by Assad and Turkish proxy troops","4:26 pm, March 2, 2020",https://meduza.io/en/news/2020/03/02/russian-military-police-enter-saraqib-syrian-city-actively-contested-by-assad-and-turkish-proxy-troops
18,"Maslenitsa, the traditional Slavic end-of-winter festival, isn’t just about eating bliny (crepe-like pancakes) with caviar or jam anymore. It’s also about finding new ways to celebrate the coming of spring that can hopefully garner a few likes on Twitter or VKontakte. For example, in the Leningrad region, one group performed their traditional burning of the chuchelo, a large effigy placed on a stake, using a flamethrower. This group the Tver region didn’t even bother lighting their chuchelo on fire manually. They simply blew it up. The villagers of Nikola-Lenivets have an annual tradition of staging a massive inferno. This year, they built a bridge 20 meters (65.6 feet) high and 66 meters (216.5 feet) long only to set it on fire. In Moscow, meanwhile, acrobats on poles gave revelers directions around Zaryadye Park while looking eerily like dementors from Harry Potter. In Stavropol, the burning of the chuchelo was far from the most spectacular part of the annual Maslenitsa celebration. Instead, the holiday featured an elephant made of bliny that was neither burned nor blown up nor even eaten. In other bliny news, a group of master cooks in the Tyumen region spent 14 years training to flip a blin three meters (almost 10 feet) in diameter and finally succeeded this year. The group’s giant, three-meter frying pan had already been entered into Russia’s nationwide book of records in previous years.","Feast your eyes on the craziest Maslenitsa celebrations to rock Russia this year. Yes, that is an elephant made of bliny.","4:13 pm, March 2, 2020",https://meduza.io/en/shapito/2020/03/02/feast-your-eyes-on-the-craziest-maslenitsa-celebrations-to-rock-russia-this-year-yes-that-is-an-elephant-made-of-bliny
19,"Russia’s consumer welfare agency, Rospotrebnadzor, has announced that a Russian citizen returning from a vacation in Italy was diagnosed with the coronavirus COVID-19. The man’s case appears to be mild, and all individuals known to have been in contact with him since his return have been placed under medical observation. According to Rospotrebnadzor, the patient was evidently infected on February 21 and returned to a private home in the Moscow region two days later. On February 27, the man entered a clinic with symptoms of an acute respiratory infection. He was taken from there to an infectious disease hospital. This case is the sixth confirmed instance of COVID-19 infection in Russia. Two of those individuals were released from hospitals on February 12; they had contracted the virus in China but recovered fully. Three other Russian citizens evacuated from the Diamond Princess cruise liner were also diagnosed with the disease. ",Russian returning home from Italy diagnosed with coronavirus in sixth confirmed case,"3:44 pm, March 2, 2020",https://meduza.io/en/news/2020/03/02/russian-returning-home-from-italy-diagnosed-with-coronavirus-in-sixth-confirmed-case
20,"Russian State Duma speaker Vyacheslav Volodin announced on March 2 that President Vladimir Putin introduced new changes to his planned constitutional reforms in advance of the Duma’s second vote on the bill. Vice Speaker Pyotr Tolstoy added that the changes include a constitutional measure defining marriage as a union between a man and a woman, Interfax reported. The independent outlet Dozhd summarized other changes, including a measure recognizing the role of the Russian ethnos in the formation of the Russian state and a clause defining the Russian Federation as the successor state of the Soviet Union. According to Interfax, these accompany other measures regarding national unity and sovereignty, including a section condemning separatism and secession and a clause enabling federal republics to establish official languages alongside Russian. Yet another amendment would include the word God in Russia’s foundational legal document. Volodin read that language aloud to reporters: “The Russian Federation, united by a thousand-year history and in testament to the memory of its ancestors, who gave us our ideals and our faith in God as well as the continuous development of the Russian state, recognizes this historically formed governmental unit.”",Putin introduces constitutional amendments mentioning God and banning same-sex marriage,"3:13 pm, March 2, 2020",https://meduza.io/en/news/2020/03/02/putin-introduces-constitutional-amendments-banning-same-sex-marriage-and-mentioning-god
21,"Vadim Solovyov is a digital artist from St. Petersburg, and his aesthetic obsession is pseudorealism. On Instagram, Solovyov creates CGI images and videos depicting a cyberpunk version of his hometown. Each piece combines the familiar with the alien: pre-fabricated apartment buildings walk around the city on mechanical legs, futuristic flying trains extend over skyscrapers, and robot snowplows grapple with malfunctioning parts. In late February, a video by Solovyov that depicted a drone taking out the trash by emerging from a prefab building went viral, drawing media attention to his work. In an interview with the Russian-language outlet TJournal, the artist said he works on his images and clips during his free time outside his day job. Solovyov also writes his own Instagram posts to flesh out the world of each photo or video. For example, the following clip of a flying patrol station came out shortly before New Year’s with this eerily cheery caption: “It’s extremely naïve to count on really feeling the New Year’s spirit if you live in Petersburg, of course. Today is December 24th, and I’m still carrying an umbrella around in my backpack. Rain, green lawns — it’s not really the winter wonderland you would expect at New Year’s. But it was so great that they came up with this holiday décor for the patrol stations! There’s a Soviet cartoon character painted on every robot! And it just immediately makes your heart a feel little happier somehow. It’s like the scent of clementines is in the air all of a sudden, as though that winter wonderland really is somewhere nearby! ✳️☃️” Another video shows a snow-clearing robot trying fruitlessly to do its job using a small fire after suffering a malfunctioned arm. Solovyov told TJournal that the clip is a reference to the winter of 2018 – 2019, when St. Petersburg city officials failed to clear snow from the streets properly, and the regional governor proposed fixing the problem by handing out shovels to local bureaucrats. It’s not just robots who inhabit the artist’s cyberpunk city. On Solovyov’s Instagram, you can also find giant creatures like flying turtles, urban octopi, and enormous reptiles being exploited to sell photographs to tourists for 500 rubles each.","From turtles in the sky to mechanical buildings, a digital artist imagines cyberpunk Petersburg on Instagram","11:19 pm, February 28, 2020",https://meduza.io/en/shapito/2020/02/29/from-turtles-in-the-sky-to-mechanical-buildings-a-digital-artist-imagines-cyberpunk-petersburg-on-instagram
